2026-01-28 19:42:14,730 [INFO] Experiment 9: Query Position Intervention
2026-01-28 19:42:14,730 [INFO] Start: 2026-01-28T19:42:14.730421
2026-01-28 19:42:57,619 [INFO] Experiment 9: Query Position Intervention
2026-01-28 19:42:57,619 [INFO] Start: 2026-01-28T19:42:57.619288
2026-01-28 19:43:19,636 [INFO] Testing layers: [0, 4, 8, 10, 11, 12, 13, 14, 16, 20, 24, 27]
2026-01-28 19:43:19,637 [INFO] 
==================================================
2026-01-28 19:43:19,637 [INFO] Pair: uppercase → sentiment
2026-01-28 19:43:19,637 [INFO] ==================================================
2026-01-28 19:43:22,866 [INFO]   Layer  0: transfer=0.00 preserve=0.70 neither=0.30 
2026-01-28 19:43:25,071 [INFO]   Layer  4: transfer=0.00 preserve=0.40 neither=0.60 
2026-01-28 19:43:27,234 [INFO]   Layer  8: transfer=0.00 preserve=1.00 neither=0.00 
2026-01-28 19:43:29,389 [INFO]   Layer 10: transfer=0.00 preserve=1.00 neither=0.00 
2026-01-28 19:43:31,515 [INFO]   Layer 11: transfer=0.00 preserve=1.00 neither=0.00 
2026-01-28 19:43:33,630 [INFO]   Layer 12: transfer=0.00 preserve=1.00 neither=0.00 
2026-01-28 19:43:35,740 [INFO]   Layer 13: transfer=0.00 preserve=1.00 neither=0.00 
2026-01-28 19:43:37,876 [INFO]   Layer 14: transfer=0.00 preserve=1.00 neither=0.00 
2026-01-28 19:43:40,007 [INFO]   Layer 16: transfer=0.00 preserve=1.00 neither=0.00 
2026-01-28 19:43:42,128 [INFO]   Layer 20: transfer=0.00 preserve=1.00 neither=0.00 
2026-01-28 19:43:44,234 [INFO]   Layer 24: transfer=0.00 preserve=1.00 neither=0.00 
2026-01-28 19:43:46,346 [INFO]   Layer 27: transfer=0.00 preserve=1.00 neither=0.00 
2026-01-28 19:43:46,347 [INFO]   Peak: layer=0, transfer=0.00
2026-01-28 19:43:46,347 [INFO] 
==================================================
2026-01-28 19:43:46,347 [INFO] Pair: linear_2x → uppercase
2026-01-28 19:43:46,347 [INFO] ==================================================
2026-01-28 19:43:49,879 [INFO]   Layer  0: transfer=0.00 preserve=1.00 neither=0.00 
2026-01-28 19:43:53,378 [INFO]   Layer  4: transfer=0.00 preserve=1.00 neither=0.00 
2026-01-28 19:43:56,941 [INFO]   Layer  8: transfer=0.00 preserve=1.00 neither=0.00 
2026-01-28 19:44:00,488 [INFO]   Layer 10: transfer=0.00 preserve=1.00 neither=0.00 
2026-01-28 19:44:04,016 [INFO]   Layer 11: transfer=0.00 preserve=1.00 neither=0.00 
2026-01-28 19:44:07,552 [INFO]   Layer 12: transfer=0.00 preserve=1.00 neither=0.00 
2026-01-28 19:44:10,938 [INFO]   Layer 13: transfer=0.00 preserve=0.70 neither=0.30 
2026-01-28 19:44:13,950 [INFO]   Layer 14: transfer=0.00 preserve=0.30 neither=0.70 
2026-01-28 19:44:16,916 [INFO]   Layer 16: transfer=0.00 preserve=0.50 neither=0.50 
2026-01-28 19:44:19,685 [INFO]   Layer 20: transfer=0.00 preserve=1.00 neither=0.00 
2026-01-28 19:44:22,532 [INFO]   Layer 24: transfer=0.00 preserve=1.00 neither=0.00 
2026-01-28 19:44:25,374 [INFO]   Layer 27: transfer=0.00 preserve=1.00 neither=0.00 
2026-01-28 19:44:25,375 [INFO]   Peak: layer=0, transfer=0.00
2026-01-28 19:44:25,375 [INFO] 
==================================================
2026-01-28 19:44:25,375 [INFO] Pair: sentiment → first_letter
2026-01-28 19:44:25,375 [INFO] ==================================================
2026-01-28 19:44:27,475 [INFO]   Layer  0: transfer=0.00 preserve=0.10 neither=0.90 
2026-01-28 19:44:29,594 [INFO]   Layer  4: transfer=0.00 preserve=0.20 neither=0.80 
2026-01-28 19:44:31,718 [INFO]   Layer  8: transfer=0.00 preserve=0.20 neither=0.80 
2026-01-28 19:44:33,860 [INFO]   Layer 10: transfer=0.00 preserve=0.10 neither=0.90 
2026-01-28 19:44:35,951 [INFO]   Layer 11: transfer=0.00 preserve=0.00 neither=1.00 
2026-01-28 19:44:38,087 [INFO]   Layer 12: transfer=0.00 preserve=0.00 neither=1.00 
2026-01-28 19:44:40,218 [INFO]   Layer 13: transfer=0.00 preserve=0.10 neither=0.90 
2026-01-28 19:44:42,348 [INFO]   Layer 14: transfer=0.00 preserve=0.50 neither=0.50 
2026-01-28 19:44:44,484 [INFO]   Layer 16: transfer=0.00 preserve=1.00 neither=0.00 
2026-01-28 19:44:46,623 [INFO]   Layer 20: transfer=0.00 preserve=1.00 neither=0.00 
2026-01-28 19:44:48,768 [INFO]   Layer 24: transfer=0.00 preserve=1.00 neither=0.00 
2026-01-28 19:44:50,891 [INFO]   Layer 27: transfer=0.00 preserve=1.00 neither=0.00 
2026-01-28 19:44:50,891 [INFO]   Peak: layer=0, transfer=0.00
2026-01-28 19:44:50,891 [INFO] 
==================================================
2026-01-28 19:44:50,891 [INFO] Pair: pattern_completion → length
2026-01-28 19:44:50,891 [INFO] ==================================================
2026-01-28 19:44:53,764 [INFO]   Layer  0: transfer=0.00 preserve=1.00 neither=0.00 
2026-01-28 19:44:56,652 [INFO]   Layer  4: transfer=0.00 preserve=1.00 neither=0.00 
2026-01-28 19:44:59,496 [INFO]   Layer  8: transfer=0.00 preserve=1.00 neither=0.00 
2026-01-28 19:45:02,340 [INFO]   Layer 10: transfer=0.00 preserve=1.00 neither=0.00 
2026-01-28 19:45:05,261 [INFO]   Layer 11: transfer=0.00 preserve=1.00 neither=0.00 
2026-01-28 19:45:08,145 [INFO]   Layer 12: transfer=0.00 preserve=1.00 neither=0.00 
2026-01-28 19:45:10,957 [INFO]   Layer 13: transfer=0.00 preserve=1.00 neither=0.00 
2026-01-28 19:45:13,766 [INFO]   Layer 14: transfer=0.00 preserve=1.00 neither=0.00 
2026-01-28 19:45:16,684 [INFO]   Layer 16: transfer=0.00 preserve=1.00 neither=0.00 
2026-01-28 19:45:19,544 [INFO]   Layer 20: transfer=0.00 preserve=1.00 neither=0.00 
2026-01-28 19:45:22,444 [INFO]   Layer 24: transfer=0.00 preserve=1.00 neither=0.00 
2026-01-28 19:45:25,333 [INFO]   Layer 27: transfer=0.00 preserve=1.00 neither=0.00 
2026-01-28 19:45:25,333 [INFO]   Peak: layer=0, transfer=0.00
2026-01-28 19:45:25,333 [INFO] 
==================================================
2026-01-28 19:45:25,333 [INFO] Pair: antonym → repeat_word
2026-01-28 19:45:25,334 [INFO] ==================================================
2026-01-28 19:45:29,046 [INFO]   Layer  0: transfer=0.00 preserve=0.90 neither=0.10 
2026-01-28 19:45:32,527 [INFO]   Layer  4: transfer=0.00 preserve=0.00 neither=1.00 
2026-01-28 19:45:36,025 [INFO]   Layer  8: transfer=0.00 preserve=0.00 neither=1.00 
2026-01-28 19:45:39,494 [INFO]   Layer 10: transfer=0.00 preserve=0.00 neither=1.00 
2026-01-28 19:45:42,925 [INFO]   Layer 11: transfer=0.00 preserve=0.00 neither=1.00 
2026-01-28 19:45:46,376 [INFO]   Layer 12: transfer=0.00 preserve=0.20 neither=0.80 
2026-01-28 19:45:49,711 [INFO]   Layer 13: transfer=0.00 preserve=0.10 neither=0.90 
2026-01-28 19:45:54,828 [INFO]   Layer 14: transfer=0.00 preserve=0.10 neither=0.90 
2026-01-28 19:46:00,055 [INFO]   Layer 16: transfer=0.00 preserve=0.30 neither=0.70 
2026-01-28 19:46:05,019 [INFO]   Layer 20: transfer=0.00 preserve=0.70 neither=0.30 
2026-01-28 19:46:07,942 [INFO]   Layer 24: transfer=0.00 preserve=1.00 neither=0.00 
2026-01-28 19:46:10,892 [INFO]   Layer 27: transfer=0.00 preserve=1.00 neither=0.00 
2026-01-28 19:46:10,892 [INFO]   Peak: layer=0, transfer=0.00
2026-01-28 19:46:10,892 [INFO] 
==================================================
2026-01-28 19:46:10,892 [INFO] Pair: first_letter → linear_2x
2026-01-28 19:46:10,893 [INFO] ==================================================
2026-01-28 19:46:20,148 [INFO]   Layer  0: transfer=0.00 preserve=0.00 neither=1.00 
2026-01-28 19:46:24,621 [INFO]   Layer  4: transfer=0.00 preserve=0.70 neither=0.30 
2026-01-28 19:46:27,410 [INFO]   Layer  8: transfer=0.00 preserve=1.00 neither=0.00 
2026-01-28 19:46:30,271 [INFO]   Layer 10: transfer=0.00 preserve=1.00 neither=0.00 
2026-01-28 19:46:33,107 [INFO]   Layer 11: transfer=0.00 preserve=1.00 neither=0.00 
2026-01-28 19:46:35,911 [INFO]   Layer 12: transfer=0.00 preserve=1.00 neither=0.00 
2026-01-28 19:46:38,718 [INFO]   Layer 13: transfer=0.00 preserve=1.00 neither=0.00 
2026-01-28 19:46:41,542 [INFO]   Layer 14: transfer=0.00 preserve=1.00 neither=0.00 
2026-01-28 19:46:44,356 [INFO]   Layer 16: transfer=0.00 preserve=1.00 neither=0.00 
2026-01-28 19:46:47,177 [INFO]   Layer 20: transfer=0.00 preserve=1.00 neither=0.00 
2026-01-28 19:46:50,026 [INFO]   Layer 24: transfer=0.00 preserve=1.00 neither=0.00 
2026-01-28 19:46:52,917 [INFO]   Layer 27: transfer=0.00 preserve=1.00 neither=0.00 
2026-01-28 19:46:52,918 [INFO]   Peak: layer=0, transfer=0.00
2026-01-28 19:46:52,918 [INFO] 
============================================================
2026-01-28 19:46:52,918 [INFO] SUMMARY
2026-01-28 19:46:52,918 [INFO] ============================================================
2026-01-28 19:46:52,919 [INFO]   Layer  0: mean transfer = 0.000
2026-01-28 19:46:52,919 [INFO]   Layer  4: mean transfer = 0.000
2026-01-28 19:46:52,919 [INFO]   Layer  8: mean transfer = 0.000
2026-01-28 19:46:52,919 [INFO]   Layer 10: mean transfer = 0.000
2026-01-28 19:46:52,919 [INFO]   Layer 11: mean transfer = 0.000
2026-01-28 19:46:52,919 [INFO]   Layer 12: mean transfer = 0.000
2026-01-28 19:46:52,919 [INFO]   Layer 13: mean transfer = 0.000
2026-01-28 19:46:52,919 [INFO]   Layer 14: mean transfer = 0.000
2026-01-28 19:46:52,920 [INFO]   Layer 16: mean transfer = 0.000
2026-01-28 19:46:52,920 [INFO]   Layer 20: mean transfer = 0.000
2026-01-28 19:46:52,920 [INFO]   Layer 24: mean transfer = 0.000
2026-01-28 19:46:52,920 [INFO]   Layer 27: mean transfer = 0.000
2026-01-28 19:46:52,933 [INFO] 
Results saved to results/exp9
2026-01-28 19:46:52,934 [INFO] Experiment 9 complete: 2026-01-28T19:46:52.934125
