2026-01-28 19:47:16,065 [INFO] Experiment 8: Multi-Position Transplantation
2026-01-28 19:47:16,065 [INFO] Start: 2026-01-28T19:47:16.065719
2026-01-28 19:47:40,342 [INFO] 
============================================================
2026-01-28 19:47:40,346 [INFO] Pair: uppercase → first_letter
2026-01-28 19:47:40,346 [INFO] ============================================================
2026-01-28 19:47:40,347 [INFO] 
  Layer 8:
2026-01-28 19:47:56,980 [INFO]     all_demo     ( 34 pos): transfer=0.00 preserve=0.00 
2026-01-28 19:48:12,026 [INFO]     input_only   ( 15 pos): transfer=0.00 preserve=1.00 
2026-01-28 19:48:27,199 [INFO]     output_only  ( 19 pos): transfer=0.00 preserve=0.10 
2026-01-28 19:48:42,707 [INFO]     last_demo    (  7 pos): transfer=0.00 preserve=0.10 
2026-01-28 19:48:42,708 [INFO] 
  Layer 12:
2026-01-28 19:48:58,455 [INFO]     all_demo     ( 34 pos): transfer=0.00 preserve=0.10 
2026-01-28 19:49:13,586 [INFO]     input_only   ( 15 pos): transfer=0.00 preserve=1.00 
2026-01-28 19:49:28,978 [INFO]     output_only  ( 19 pos): transfer=0.00 preserve=0.10 
2026-01-28 19:49:44,789 [INFO]     last_demo    (  7 pos): transfer=0.00 preserve=0.10 
2026-01-28 19:49:44,790 [INFO] 
  Layer 14:
2026-01-28 19:50:00,451 [INFO]     all_demo     ( 34 pos): transfer=0.00 preserve=0.10 
2026-01-28 19:50:15,773 [INFO]     input_only   ( 15 pos): transfer=0.00 preserve=1.00 
2026-01-28 19:50:31,593 [INFO]     output_only  ( 19 pos): transfer=0.00 preserve=0.00 
2026-01-28 19:50:46,176 [INFO]     last_demo    (  7 pos): transfer=0.00 preserve=0.10 
2026-01-28 19:50:46,176 [INFO] 
  Layer 16:
2026-01-28 19:51:00,826 [INFO]     all_demo     ( 34 pos): transfer=0.00 preserve=0.10 
2026-01-28 19:51:16,177 [INFO]     input_only   ( 15 pos): transfer=0.00 preserve=1.00 
2026-01-28 19:51:31,439 [INFO]     output_only  ( 19 pos): transfer=0.00 preserve=0.10 
2026-01-28 19:51:46,851 [INFO]     last_demo    (  7 pos): transfer=0.00 preserve=0.10 
2026-01-28 19:51:46,852 [INFO] 
============================================================
2026-01-28 19:51:46,852 [INFO] Pair: uppercase → repeat_word
2026-01-28 19:51:46,852 [INFO] ============================================================
2026-01-28 19:51:46,852 [INFO] 
  Layer 8:
2026-01-28 19:52:02,296 [INFO]     all_demo     ( 34 pos): transfer=0.90 preserve=0.00 ***
2026-01-28 19:52:17,543 [INFO]     input_only   ( 15 pos): transfer=0.00 preserve=1.00 
2026-01-28 19:52:32,954 [INFO]     output_only  ( 19 pos): transfer=0.90 preserve=0.00 ***
2026-01-28 19:52:48,354 [INFO]     last_demo    (  7 pos): transfer=0.00 preserve=1.00 
2026-01-28 19:52:48,354 [INFO] 
  Layer 12:
2026-01-28 19:53:03,766 [INFO]     all_demo     ( 34 pos): transfer=0.30 preserve=0.30 
2026-01-28 19:53:19,115 [INFO]     input_only   ( 15 pos): transfer=0.00 preserve=1.00 
2026-01-28 19:53:34,448 [INFO]     output_only  ( 19 pos): transfer=0.30 preserve=0.00 
2026-01-28 19:53:49,730 [INFO]     last_demo    (  7 pos): transfer=0.00 preserve=1.00 
2026-01-28 19:53:49,730 [INFO] 
  Layer 14:
2026-01-28 19:54:05,509 [INFO]     all_demo     ( 34 pos): transfer=0.00 preserve=1.00 
2026-01-28 19:54:20,857 [INFO]     input_only   ( 15 pos): transfer=0.00 preserve=1.00 
2026-01-28 19:54:36,025 [INFO]     output_only  ( 19 pos): transfer=0.00 preserve=1.00 
2026-01-28 19:54:51,046 [INFO]     last_demo    (  7 pos): transfer=0.00 preserve=1.00 
2026-01-28 19:54:51,047 [INFO] 
  Layer 16:
2026-01-28 19:55:06,018 [INFO]     all_demo     ( 34 pos): transfer=0.00 preserve=1.00 
2026-01-28 19:55:20,982 [INFO]     input_only   ( 15 pos): transfer=0.00 preserve=1.00 
2026-01-28 19:55:36,500 [INFO]     output_only  ( 19 pos): transfer=0.00 preserve=1.00 
2026-01-28 19:55:52,352 [INFO]     last_demo    (  7 pos): transfer=0.00 preserve=1.00 
2026-01-28 19:55:52,353 [INFO] 
============================================================
2026-01-28 19:55:52,353 [INFO] Pair: first_letter → repeat_word
2026-01-28 19:55:52,353 [INFO] ============================================================
2026-01-28 19:55:52,353 [INFO] 
  Layer 8:
2026-01-28 19:56:08,117 [INFO]     all_demo     ( 30 pos): transfer=0.00 preserve=0.40 
2026-01-28 19:56:23,962 [INFO]     input_only   ( 15 pos): transfer=0.00 preserve=1.00 
2026-01-28 19:56:37,702 [INFO]     output_only  ( 15 pos): transfer=0.00 preserve=0.20 
2026-01-28 19:56:50,723 [INFO]     last_demo    (  6 pos): transfer=0.00 preserve=1.00 
2026-01-28 19:56:50,724 [INFO] 
  Layer 12:
2026-01-28 19:57:06,301 [INFO]     all_demo     ( 30 pos): transfer=0.00 preserve=1.00 
2026-01-28 19:57:20,896 [INFO]     input_only   ( 15 pos): transfer=0.00 preserve=1.00 
2026-01-28 19:57:36,078 [INFO]     output_only  ( 15 pos): transfer=0.00 preserve=1.00 
2026-01-28 19:57:51,382 [INFO]     last_demo    (  6 pos): transfer=0.00 preserve=1.00 
2026-01-28 19:57:51,383 [INFO] 
  Layer 14:
2026-01-28 19:58:06,681 [INFO]     all_demo     ( 30 pos): transfer=0.00 preserve=1.00 
2026-01-28 19:58:22,212 [INFO]     input_only   ( 15 pos): transfer=0.00 preserve=1.00 
2026-01-28 19:58:38,091 [INFO]     output_only  ( 15 pos): transfer=0.00 preserve=1.00 
2026-01-28 19:58:54,047 [INFO]     last_demo    (  6 pos): transfer=0.00 preserve=1.00 
2026-01-28 19:58:54,047 [INFO] 
  Layer 16:
2026-01-28 19:59:09,722 [INFO]     all_demo     ( 30 pos): transfer=0.00 preserve=1.00 
2026-01-28 19:59:25,299 [INFO]     input_only   ( 15 pos): transfer=0.00 preserve=1.00 
2026-01-28 19:59:40,948 [INFO]     output_only  ( 15 pos): transfer=0.00 preserve=1.00 
2026-01-28 19:59:56,484 [INFO]     last_demo    (  6 pos): transfer=0.00 preserve=1.00 
2026-01-28 19:59:56,484 [INFO] 
============================================================
2026-01-28 19:59:56,485 [INFO] Pair: uppercase → sentiment
2026-01-28 19:59:56,485 [INFO] ============================================================
2026-01-28 19:59:56,485 [INFO] 
  Layer 8:
2026-01-28 20:00:11,705 [INFO]     all_demo     ( 34 pos): transfer=0.00 preserve=0.00 
2026-01-28 20:00:27,199 [INFO]     input_only   ( 15 pos): transfer=0.00 preserve=1.00 
2026-01-28 20:00:42,525 [INFO]     output_only  ( 19 pos): transfer=0.00 preserve=0.00 
2026-01-28 20:00:57,806 [INFO]     last_demo    (  7 pos): transfer=0.00 preserve=0.00 
2026-01-28 20:00:57,807 [INFO] 
  Layer 12:
2026-01-28 20:01:13,092 [INFO]     all_demo     ( 34 pos): transfer=0.00 preserve=0.30 
2026-01-28 20:01:28,791 [INFO]     input_only   ( 15 pos): transfer=0.00 preserve=1.00 
2026-01-28 20:01:43,851 [INFO]     output_only  ( 19 pos): transfer=0.00 preserve=0.30 
2026-01-28 20:01:59,144 [INFO]     last_demo    (  7 pos): transfer=0.00 preserve=0.30 
2026-01-28 20:01:59,144 [INFO] 
  Layer 14:
2026-01-28 20:02:14,399 [INFO]     all_demo     ( 34 pos): transfer=0.00 preserve=0.30 
2026-01-28 20:02:29,861 [INFO]     input_only   ( 15 pos): transfer=0.00 preserve=1.00 
2026-01-28 20:02:45,172 [INFO]     output_only  ( 19 pos): transfer=0.00 preserve=0.30 
2026-01-28 20:03:00,157 [INFO]     last_demo    (  7 pos): transfer=0.00 preserve=0.30 
2026-01-28 20:03:00,157 [INFO] 
  Layer 16:
2026-01-28 20:03:15,193 [INFO]     all_demo     ( 34 pos): transfer=0.00 preserve=0.30 
2026-01-28 20:03:29,952 [INFO]     input_only   ( 15 pos): transfer=0.00 preserve=1.00 
2026-01-28 20:03:45,600 [INFO]     output_only  ( 19 pos): transfer=0.00 preserve=0.30 
2026-01-28 20:04:00,664 [INFO]     last_demo    (  7 pos): transfer=0.00 preserve=0.30 
2026-01-28 20:04:00,664 [INFO] 
============================================================
2026-01-28 20:04:00,664 [INFO] Pair: linear_2x → length
2026-01-28 20:04:00,664 [INFO] ============================================================
2026-01-28 20:04:00,664 [INFO] 
  Layer 8:
2026-01-28 20:04:16,225 [INFO]     all_demo     ( 40 pos): transfer=0.00 preserve=0.00 
2026-01-28 20:04:31,582 [INFO]     input_only   ( 20 pos): transfer=0.00 preserve=1.00 
2026-01-28 20:04:46,992 [INFO]     output_only  ( 20 pos): transfer=0.00 preserve=0.10 
2026-01-28 20:05:02,459 [INFO]     last_demo    (  8 pos): transfer=0.00 preserve=0.00 
2026-01-28 20:05:02,460 [INFO] 
  Layer 12:
2026-01-28 20:05:17,741 [INFO]     all_demo     ( 40 pos): transfer=0.00 preserve=0.00 
2026-01-28 20:05:32,856 [INFO]     input_only   ( 20 pos): transfer=0.00 preserve=1.00 
2026-01-28 20:05:48,570 [INFO]     output_only  ( 20 pos): transfer=0.00 preserve=0.10 
2026-01-28 20:06:04,216 [INFO]     last_demo    (  8 pos): transfer=0.00 preserve=0.00 
2026-01-28 20:06:04,216 [INFO] 
  Layer 14:
2026-01-28 20:06:19,602 [INFO]     all_demo     ( 40 pos): transfer=0.00 preserve=0.10 
2026-01-28 20:06:34,865 [INFO]     input_only   ( 20 pos): transfer=0.00 preserve=1.00 
2026-01-28 20:06:50,420 [INFO]     output_only  ( 20 pos): transfer=0.00 preserve=0.10 
2026-01-28 20:07:06,131 [INFO]     last_demo    (  8 pos): transfer=0.00 preserve=0.10 
2026-01-28 20:07:06,131 [INFO] 
  Layer 16:
2026-01-28 20:07:22,019 [INFO]     all_demo     ( 40 pos): transfer=0.00 preserve=0.10 
2026-01-28 20:07:38,340 [INFO]     input_only   ( 20 pos): transfer=0.00 preserve=1.00 
2026-01-28 20:07:54,046 [INFO]     output_only  ( 20 pos): transfer=0.00 preserve=0.10 
2026-01-28 20:08:09,582 [INFO]     last_demo    (  8 pos): transfer=0.00 preserve=0.10 
2026-01-28 20:08:09,583 [INFO] 
============================================================
2026-01-28 20:08:09,583 [INFO] Pair: sentiment → antonym
2026-01-28 20:08:09,583 [INFO] ============================================================
2026-01-28 20:08:09,583 [INFO] 
  Layer 8:
2026-01-28 20:08:24,754 [INFO]     all_demo     ( 30 pos): transfer=0.10 preserve=0.70 
2026-01-28 20:08:40,053 [INFO]     input_only   ( 15 pos): transfer=0.00 preserve=1.00 
2026-01-28 20:08:55,316 [INFO]     output_only  ( 15 pos): transfer=0.10 preserve=0.80 
2026-01-28 20:09:10,745 [INFO]     last_demo    (  6 pos): transfer=0.00 preserve=1.00 
2026-01-28 20:09:10,746 [INFO] 
  Layer 12:
2026-01-28 20:09:25,950 [INFO]     all_demo     ( 30 pos): transfer=0.00 preserve=1.00 
2026-01-28 20:09:41,067 [INFO]     input_only   ( 15 pos): transfer=0.00 preserve=1.00 
2026-01-28 20:09:56,652 [INFO]     output_only  ( 15 pos): transfer=0.00 preserve=1.00 
2026-01-28 20:10:12,004 [INFO]     last_demo    (  6 pos): transfer=0.00 preserve=1.00 
2026-01-28 20:10:12,004 [INFO] 
  Layer 14:
2026-01-28 20:10:27,726 [INFO]     all_demo     ( 30 pos): transfer=0.00 preserve=1.00 
2026-01-28 20:10:43,244 [INFO]     input_only   ( 15 pos): transfer=0.00 preserve=1.00 
2026-01-28 20:10:58,497 [INFO]     output_only  ( 15 pos): transfer=0.00 preserve=1.00 
2026-01-28 20:11:13,628 [INFO]     last_demo    (  6 pos): transfer=0.00 preserve=1.00 
2026-01-28 20:11:13,629 [INFO] 
  Layer 16:
2026-01-28 20:11:29,030 [INFO]     all_demo     ( 30 pos): transfer=0.00 preserve=1.00 
2026-01-28 20:11:44,602 [INFO]     input_only   ( 15 pos): transfer=0.00 preserve=1.00 
2026-01-28 20:12:00,250 [INFO]     output_only  ( 15 pos): transfer=0.00 preserve=1.00 
2026-01-28 20:12:15,921 [INFO]     last_demo    (  6 pos): transfer=0.00 preserve=1.00 
2026-01-28 20:12:15,922 [INFO] 
============================================================
2026-01-28 20:12:15,922 [INFO] SUMMARY BY CONDITION
2026-01-28 20:12:15,922 [INFO] ============================================================
2026-01-28 20:12:15,922 [INFO]   Layer  8, all_demo    : mean transfer = 0.167
2026-01-28 20:12:15,923 [INFO]   Layer 12, all_demo    : mean transfer = 0.050
2026-01-28 20:12:15,923 [INFO]   Layer 14, all_demo    : mean transfer = 0.000
2026-01-28 20:12:15,923 [INFO]   Layer 16, all_demo    : mean transfer = 0.000
2026-01-28 20:12:15,923 [INFO]   Layer  8, input_only  : mean transfer = 0.000
2026-01-28 20:12:15,923 [INFO]   Layer 12, input_only  : mean transfer = 0.000
2026-01-28 20:12:15,923 [INFO]   Layer 14, input_only  : mean transfer = 0.000
2026-01-28 20:12:15,923 [INFO]   Layer 16, input_only  : mean transfer = 0.000
2026-01-28 20:12:15,923 [INFO]   Layer  8, output_only : mean transfer = 0.167
2026-01-28 20:12:15,924 [INFO]   Layer 12, output_only : mean transfer = 0.050
2026-01-28 20:12:15,924 [INFO]   Layer 14, output_only : mean transfer = 0.000
2026-01-28 20:12:15,924 [INFO]   Layer 16, output_only : mean transfer = 0.000
2026-01-28 20:12:15,924 [INFO]   Layer  8, last_demo   : mean transfer = 0.000
2026-01-28 20:12:15,924 [INFO]   Layer 12, last_demo   : mean transfer = 0.000
2026-01-28 20:12:15,924 [INFO]   Layer 14, last_demo   : mean transfer = 0.000
2026-01-28 20:12:15,924 [INFO]   Layer 16, last_demo   : mean transfer = 0.000
2026-01-28 20:12:15,928 [INFO] 
Results saved to results/exp8
2026-01-28 20:12:15,928 [INFO] Experiment 8 complete: 2026-01-28T20:12:15.928600
